{
  "$schema": "https://json-schema.org/draft/2020-12/schema",
  "$id": "clinical-document.schema.json",
  "$comment": "UX-8A — source de vérité pour tout document généré. `documentKind` (type clinique) et `exportTarget` (format de fichier exporté) sont deux concepts distincts : exportTarget n'apparaît PAS sur ce document — c'est un paramètre d'export (UX-1/UX-2B), jamais un champ persisté sur ClinicalDocument. Ne référence le rendu que par renderManifestId (jamais template/brandKit/rendererVersion dupliqués ici, cf. render-manifest.schema.json). Pour schemaVersion:1, un champ inconnu est rejeté (additionalProperties:false partout), jamais silencieusement ignoré.",
  "$defs": {
    "derivedFrom": {
      "$comment": "null pour une génération initiale ou une simple édition (nouvelle version du même document). Renseigné uniquement par une transformation UX-8D (Magic Switch), qui crée un document dérivé — jamais par une édition (UX-9A) ni par un export (UX-1/UX-2B).",
      "type": [
        "object",
        "null"
      ],
      "required": [
        "documentId",
        "versionId",
        "operation"
      ],
      "additionalProperties": false,
      "properties": {
        "documentId": {
          "type": "string",
          "minLength": 1
        },
        "versionId": {
          "type": "string",
          "minLength": 1
        },
        "operation": {
          "const": "document-kind-change"
        }
      }
    },
    "qcStatus": {
      "$comment": "Vocabulaire réutilisé de claimSupport (block.schema.json) pour les quatre dimensions de contrôle qualité automatique : pending (pas encore vérifié), pass, needs-review.",
      "enum": [
        "pending",
        "pass",
        "needs-review"
      ]
    },
    "validation": {
      "type": "object",
      "required": [
        "sourceIntegrity",
        "contentCompleteness",
        "layout",
        "accessibility",
        "humanClinicalReview"
      ],
      "additionalProperties": false,
      "properties": {
        "sourceIntegrity": {
          "$ref": "#/$defs/qcStatus"
        },
        "contentCompleteness": {
          "$ref": "#/$defs/qcStatus"
        },
        "layout": {
          "$ref": "#/$defs/qcStatus"
        },
        "accessibility": {
          "$ref": "#/$defs/qcStatus"
        },
        "humanClinicalReview": {
          "const": "required",
          "$comment": "Reste toujours présent, à 'required' par défaut — la certification clinique reste à la charge de la clinicienne, un contrôle automatique ne peut jamais la remplacer. Un mécanisme de transition (ex. 'reviewed') appartient à une phase ultérieure, hors périmètre UX-8A."
        }
      }
    }
  },
  "type": "object",
  "required": [
    "schemaVersion",
    "documentId",
    "versionId",
    "previousVersionId",
    "requestId",
    "sourceSnapshotId",
    "createdAt",
    "language",
    "status",
    "title",
    "purpose",
    "audience",
    "documentKind",
    "renderManifestId",
    "derivedFrom",
    "blocks",
    "citations",
    "validation"
  ],
  "additionalProperties": false,
  "properties": {
    "schemaVersion": {
      "const": 1
    },
    "documentId": {
      "type": "string",
      "minLength": 1
    },
    "versionId": {
      "type": "string",
      "minLength": 1
    },
    "previousVersionId": {
      "type": [
        "string",
        "null"
      ],
      "$comment": "null pour la première version d'un document. Renseigné par une édition (UX-9A) — jamais par une transformation (voir derivedFrom) ni par un export."
    },
    "requestId": {
      "type": "string",
      "minLength": 1
    },
    "sourceSnapshotId": {
      "type": "string",
      "minLength": 1
    },
    "createdAt": {
      "type": "string",
      "format": "date-time"
    },
    "language": {
      "type": "string",
      "minLength": 2,
      "maxLength": 5
    },
    "status": {
      "type": "string",
      "minLength": 1
    },
    "title": {
      "type": "string",
      "minLength": 1
    },
    "titleStyle": {
      "$comment": "Q1 — mise en forme du titre du document (titre de couverture). Même $ref et même règle que cardContent.titleStyle : optionnel, absent = affichage actuel exact.",
      "$ref": "block.schema.json#/$defs/blockStyle"
    },
    "purpose": {
      "type": "string",
      "minLength": 1
    },
    "audience": {
      "type": "string",
      "minLength": 1
    },
    "documentKind": {
      "enum": [
        "fiche",
        "carrousel",
        "tableau",
        "script",
        "liens",
        "presentation"
      ]
    },
    "renderManifestId": {
      "type": "string",
      "minLength": 1
    },
    "derivedFrom": {
      "$ref": "#/$defs/derivedFrom"
    },
    "blocks": {
      "type": "array",
      "$comment": "Type d'élément affiné par documentKind via les règles allOf/if/then ci-dessous : editorialBlock pour 'fiche', cardOnlyBlock (uniquement des `card`) pour 'carrousel' ET 'presentation' (LOT 1 — une diapositive de Présentation réutilise telle quelle la structure `card` du Carrousel). tableau/script/liens ne sont pas encore migrés (UX-8M) — leurs blocs restent un union générique non contrainte à ce stade, aucun modèle de bloc n'étant encore défini pour eux. Q5 — les réglages imageDisplay facultatifs des couvertures et blocs image sont validés dans block.schema.json, sans champ racine supplémentaire."
    },
    "citations": {
      "type": "array",
      "items": {
        "$ref": "citation.schema.json"
      }
    },
    "deepDives": {
      "$comment": "Présentation ACTE 2, Phase 1 — pages d'approfondissement plein écran (v1 sobre : titre + paragraphes uniquement, jamais de callout/liste/citation/image). Champ OPTIONNEL au niveau racine (absent des documents déjà générés avant ce lot, qui restent valides tels quels) — tableau racine calqué EXACTEMENT sur le patron déjà établi par `citations` ci-dessus : référencé par identifiant plat (`targetId`) depuis n'importe quel bloc porteur de prose (block.schema.json#/$defs/deepDiveLinks), jamais imbriqué dans un bloc. ACTE 3 — la profondeur n'est plus structurellement limitée à 1 niveau : un paragraphe d'une page d'approfondissement peut à son tour porter `deepDiveLinks` et référencer une autre entrée de ce même tableau. La profondeur pertinente est jugée par le modèle à la génération, jamais plafonnée par un chiffre dans le code ; les CYCLES (A→B→A) sont coupés à la conversion par un parcours en profondeur à trois couleurs sur le graphe des liens survivants (convertDeepDive, studio-clinique-core.js), et une seconde fois en navigation (adocPresentOpenDeepDive vérifie la pile) — jamais une règle de prompt supposée respectée.",
      "type": "array",
      "items": {
        "type": "object",
        "required": [
          "id",
          "title",
          "paragraphs"
        ],
        "additionalProperties": false,
        "properties": {
          "id": {
            "type": "string",
            "minLength": 1
          },
          "title": {
            "type": "string",
            "minLength": 1
          },
          "imageQuery": {
            "$comment": "Illustration de la page, reportée telle quelle par adocConvertDeepDives quand le modèle en fournit une (schéma d'outil, emit_presentation_document). Champs OMIS quand la requête est vide : minLength 1 refuse donc une chaîne vide, jamais un champ à moitié rempli. additionalProperties:false reste en vigueur — un champ inconnu continue d'être rejeté.",
            "type": "string",
            "minLength": 1
          },
          "imageAlt": {
            "$comment": "Texte alternatif de l'illustration ci-dessus, reporté par le même mécanisme. Présent uniquement avec imageQuery.",
            "type": "string",
            "minLength": 1
          },
          "paragraphs": {
            "type": "array",
            "minItems": 1,
            "items": {
              "$comment": "Présentation ACTE 3 — un paragraphe reste une simple chaîne dans le cas très largement majoritaire (aucun lien), et ne devient un objet {text, deepDiveLinks} que s'il porte effectivement un lien vers une AUTRE page d'approfondissement. Forme additive à empreinte nulle, strictement rétrocompatible : tout document produit en Phase 1/2 (paragraphes = tableau de chaînes) reste valide tel quel, sans conversion ni migration.",
              "oneOf": [
                {
                  "type": "string",
                  "minLength": 1
                },
                {
                  "type": "object",
                  "required": [
                    "text"
                  ],
                  "additionalProperties": false,
                  "properties": {
                    "text": {
                      "type": "string",
                      "minLength": 1
                    },
                    "deepDiveLinks": {
                      "$ref": "block.schema.json#/$defs/deepDiveLinks"
                    }
                  }
                }
              ]
            }
          }
        }
      }
    },
    "modules": {
      "$comment": "Cours en puzzle — un cours long est généré en MODULES autonomes (présentations ordinaires de 8 à 12 diapositives) puis assemblé par du code déterministe en un seul document. Ce tableau conserve la trace de cet assemblage : une entrée par module, dans l'ordre, pointant sur la diapositive de titre que l'assembleur a construite. Il sert au sommaire groupé (adocPresentBuildTocHTML) et au remplacement d'un module suivi d'un réassemblage. Champ OPTIONNEL au niveau racine, sur le patron exact de `deepDives` ci-dessus : un document qui n'en porte pas — c'est-à-dire toute présentation ordinaire, cas très largement majoritaire — reste valide et se rend STRICTEMENT comme avant. Jamais ajouté à `required`, jamais présent à vide.",
      "type": "array",
      "items": {
        "type": "object",
        "required": [
          "id",
          "title",
          "cardId"
        ],
        "additionalProperties": false,
        "properties": {
          "id": {
            "type": "string",
            "minLength": 1
          },
          "title": {
            "type": "string",
            "minLength": 1
          },
          "cardId": {
            "type": "string",
            "minLength": 1
          }
        }
      }
    },
    "narration": {
      "$comment": "Lot 1a — narration par ÉTAPE de Présentation, à la RACINE du document : jamais sur une carte, jamais sur un bloc. Une étape est désignée par son `stepId` — l'identifiant du bloc révélé, ou celui de la carte pour une carte sans bloc, exactement la règle d'étape d'adocPresentApplyReveal. Un `stepId` suffit SEUL parce que les identifiants de blocs sont uniques dans tout le document par construction : adocNextBlockId parcourt doc.blocks ET content.blocks avant d'émettre, et les deux générateurs de génération (convertBlock, idBloc) tiennent un compteur jamais remis à zéro d'une carte à l'autre. Réordonner ne réécrit aucun identifiant ; l'assemblage de cours, qui les réécrit tous, reporte la narration (adocAssembleCourse). Les entrées devenues orphelines sont purgées à l'enregistrement (adocNarrationPurge). Champ OPTIONNEL au niveau racine, sur le patron exact de `deepDives` et de `modules` ci-dessus : un document qui n'en porte pas reste valide et se rend STRICTEMENT comme avant. Jamais ajouté à `required`, jamais présent à vide. JAMAIS exporté : adocDocumentPourExport le retire avant l'embarquement du document dans un fichier autonome — la narration est une note de travail, pas un contenu du document.",
      "type": "array",
      "items": {
        "type": "object",
        "required": [
          "stepId",
          "text"
        ],
        "additionalProperties": false,
        "properties": {
          "stepId": {
            "type": "string",
            "minLength": 1
          },
          "text": {
            "type": "string",
            "minLength": 1
          }
        }
      }
    },
    "validation": {
      "$ref": "#/$defs/validation"
    }
  },
  "allOf": [
    {
      "if": {
        "properties": {
          "documentKind": {
            "const": "fiche"
          }
        },
        "required": [
          "documentKind"
        ]
      },
      "then": {
        "properties": {
          "blocks": {
            "type": "array",
            "minItems": 1,
            "items": {
              "$ref": "block.schema.json#/$defs/editorialBlock"
            }
          }
        }
      }
    },
    {
      "$comment": "LOT 1 Présentation (6e documentKind) — fusionne 'presentation' dans CETTE MÊME branche que 'carrousel' (jamais une seconde branche dupliquée, régression #6) : une diapositive de Présentation EST structurellement une carte de Carrousel (card/cardContent/nestedBlock réutilisés tels quels, cf. investigation — aucun nouveau niveau d'imbrication). Seule la contrainte de POSITION diverge (branche suivante) : presentation, contrairement à carrousel, n'autorise jamais x/y/width/height/zIndex sur ses blocs de premier niveau (ordre strictement séquentiel entre diapositives, décision Christophe — jamais un canevas façon Prezi).",
      "if": {
        "properties": {
          "documentKind": {
            "enum": [
              "carrousel",
              "presentation"
            ]
          }
        },
        "required": [
          "documentKind"
        ]
      },
      "then": {
        "properties": {
          "blocks": {
            "type": "array",
            "minItems": 1,
            "items": {
              "$ref": "block.schema.json#/$defs/cardOnlyBlock"
            },
            "$comment": "Un document carrousel ou presentation n'a QUE des blocs `card` au niveau racine — jamais un bloc éditorial orphelin. Chaque carte (diapositive pour presentation) porte ses propres blocs enfants dans content.blocks[]."
          }
        }
      }
    },
    {
      "$comment": "ITEM 75 Phase 1 (complément, 18 septembre 2026) — garde-fou décidé par Christophe : x/y/width/height/zIndex (block.schema.json#/$defs/blockStyle, ITEM 75 Phase 1 initial) réservés au documentKind carrousel, rejetés par AJV ailleurs (échec fermé, pas un simple avertissement — cohérence avec la posture A18). Même patron allOf/if/then que les deux branches ci-dessus, appliqué à l'inverse : fiche/tableau/script/liens/presentation (jamais carrousel) ne peuvent pas porter ces 5 champs sur un bloc de premier niveau. Ne s'applique qu'aux blocs de PREMIER NIVEAU (doc.blocks[]) — jamais aux blocs imbriqués de card.content.blocks[] (block.schema.json#/$defs/nestedBlock), seul endroit où ces champs ont un sens (une carte, elle, n'a pas de `style` — cardBlock ne le définit pas), donc aucune récursion n'est nécessaire ici : un document non-carrousel n'a jamais de bloc `card` à sa racine (branche `fiche` ci-dessus l'exclut déjà d'editorialBlock ; tableau/script/liens restent une union non contrainte, UX-8M, mais ce garde-fou n'élargit ni ne réduit cette lacune déjà documentée, il ferme seulement la fuite de position). LOT 1 Présentation — 'presentation' rejoint cette liste interdite (jamais la branche carrousel ci-dessus) : décision explicite Christophe, une Présentation garde un ordre strictement séquentiel entre diapositives, contrairement au Carrousel qui autorise le positionnement libre de ses cartes. Combine par ET (allOf) avec la contrainte de forme déjà posée pour 'fiche' ci-dessus — un bloc de Fiche doit rester conforme à editorialBlock ET ne jamais porter ces 5 champs.",
      "if": {
        "properties": {
          "documentKind": {
            "enum": [
              "fiche",
              "tableau",
              "script",
              "liens",
              "presentation"
            ]
          }
        },
        "required": [
          "documentKind"
        ]
      },
      "then": {
        "properties": {
          "blocks": {
            "type": "array",
            "items": {
              "type": "object",
              "properties": {
                "style": {
                  "type": "object",
                  "not": {
                    "anyOf": [
                      {
                        "properties": {
                          "x": {}
                        },
                        "required": [
                          "x"
                        ]
                      },
                      {
                        "properties": {
                          "y": {}
                        },
                        "required": [
                          "y"
                        ]
                      },
                      {
                        "properties": {
                          "width": {}
                        },
                        "required": [
                          "width"
                        ]
                      },
                      {
                        "properties": {
                          "height": {}
                        },
                        "required": [
                          "height"
                        ]
                      },
                      {
                        "properties": {
                          "zIndex": {}
                        },
                        "required": [
                          "zIndex"
                        ]
                      }
                    ]
                  }
                }
              }
            }
          }
        }
      }
    }
  ]
}
