{
  "schemaVersion": 1,
  "documentId": "doc-carrousel-type-001",
  "versionId": "doc-carrousel-type-001-v1",
  "previousVersionId": null,
  "requestId": "request-doc-carrousel-type-001",
  "sourceSnapshotId": "snapshot-carrousel-type-001",
  "createdAt": "2026-09-03T09:00:00Z",
  "language": "fr",
  "status": "draft",
  "title": "Les cavaliers de l'apocalypse — parcours en cartes",
  "purpose": "supervision",
  "audience": "clinicien",
  "documentKind": "carrousel",
  "renderManifestId": "manifest-default-001",
  "derivedFrom": null,
  "blocks": [
    {
      "id": "card-01",
      "type": "card",
      "content": {
        "title": "Comprendre le mécanisme",
        "imageRef": null,
        "imageAlt": null,
        "blocks": [
          {
            "id": "card-01-paragraph-01",
            "type": "paragraph",
            "content": {
              "text": "Un style d'attachement évitant se traduit par une désactivation des besoins de proximité, une préférence pour l'autonomie et une difficulté à demander du soutien. Le style désorganisé, souvent issu de traumatismes précoces, combine simultanément recherche de proximité et peur de cette même proximité. Young a développé le concept de schémas précoces inadaptés pour décrire des patterns cognitifs et émotionnels durables, ancrés dans l'enfance, qui structurent la perception de soi et des relations."
            },
            "citationIds": [
              "citation-001"
            ],
            "validation": {
              "citationLinks": [
                {
                  "citationId": "citation-001",
                  "claimText": "Un style d'attachement évitant se traduit par une désactivation des besoins de proximité, une préférence pour l'autonomie et une difficulté à demander du soutien.",
                  "claimSupport": "pass"
                }
              ]
            }
          },
          {
            "id": "card-01-paragraph-02",
            "type": "paragraph",
            "content": {
              "text": "Le schéma de méfiance/abus conduit à interpréter les intentions du partenaire comme potentiellement malveillantes, rendant la confiance difficile à établir durablement. Le schéma de carence affective renvoie à la conviction que ses besoins émotionnels ne seront jamais suffisamment comblés par autrui, quel que soit l'effort de l'autre. La communication non violente propose de distinguer observation, sentiment, besoin et demande — une structure qui désamorce l'escalade critique-défense typique des couples en difficulté."
            },
            "citationIds": [
              "citation-002"
            ],
            "validation": {
              "citationLinks": [
                {
                  "citationId": "citation-002",
                  "claimText": "Le schéma de méfiance/abus conduit à interpréter les intentions du partenaire comme potentiellement malveillantes, rendant la confiance difficile à établir durablement.",
                  "claimSupport": "pass"
                }
              ]
            }
          }
        ]
      },
      "citationIds": [],
      "validation": {}
    },
    {
      "id": "card-02",
      "type": "card",
      "content": {
        "title": "Le premier cavalier : la critique",
        "imageRef": null,
        "imageAlt": null,
        "blocks": [
          {
            "id": "card-02-paragraph-01",
            "type": "paragraph",
            "content": {
              "text": "L'EMDR mobilise les mouvements oculaires bilatéraux pour faciliter le retraitement adaptatif de souvenirs traumatiques restés bloqués dans leur forme originelle, non intégrée. L'IFS (Internal Family Systems) conceptualise le psychisme comme un système de parties — exilés, protecteurs, pompiers — organisées autour d'un Soi central capable de les accueillir avec curiosité. La réparation après une rupture de communication reste l'indicateur le plus prédictif de stabilité conjugale à long terme, davantage que l'absence de conflit elle-même."
            },
            "citationIds": [
              "citation-003"
            ],
            "validation": {
              "citationLinks": [
                {
                  "citationId": "citation-003",
                  "claimText": "L'EMDR mobilise les mouvements oculaires bilatéraux pour faciliter le retraitement adaptatif de souvenirs traumatiques restés bloqués dans leur forme originelle, non intégrée.",
                  "claimSupport": "pass"
                }
              ]
            }
          },
          {
            "id": "card-02-paragraph-02",
            "type": "paragraph",
            "content": {
              "text": "La rupture du lien d'attachement précoce peut se rejouer à l'âge adulte sous forme de protestations relationnelles disproportionnées face à des séparations pourtant banales. Le travail thérapeutique sur les schémas vise moins l'éradication du schéma que le développement d'un mode adulte sain capable de moduler sa réactivation. Les ruptures de dialogue répétées finissent par éroder la carte d'amour — la connaissance intime que chaque partenaire a du monde intérieur de l'autre."
            },
            "citationIds": [],
            "validation": {}
          }
        ]
      },
      "citationIds": [],
      "validation": {}
    },
    {
      "id": "card-03",
      "type": "card",
      "content": {
        "title": "Le second cavalier : le mépris",
        "imageRef": null,
        "imageAlt": null,
        "blocks": [
          {
            "id": "card-03-paragraph-01",
            "type": "paragraph",
            "content": {
              "text": "La psychoéducation sur les styles d'attachement permet souvent au couple de dépersonnaliser le conflit, en le reformulant comme une rencontre de deux stratégies de régulation plutôt qu'une accusation. Les techniques de recadrage transforment une plainte accusatrice en expression d'un besoin non satisfait, ouvrant un espace de négociation là où existait un blocage. La vigilance clinique reste nécessaire : un mépris chronique et non traité constitue un facteur de risque documenté, y compris en dehors du cadre relationnel lui-même."
            },
            "citationIds": [
              "citation-004"
            ],
            "validation": {
              "citationLinks": [
                {
                  "citationId": "citation-004",
                  "claimText": "La psychoéducation sur les styles d'attachement permet souvent au couple de dépersonnaliser le conflit, en le reformulant comme une rencontre de deux stratégies de régulation plutôt qu'une accusation.",
                  "claimSupport": "pass"
                }
              ]
            }
          },
          {
            "id": "card-03-paragraph-02",
            "type": "paragraph",
            "content": {
              "text": "Le sentiment de sécurité de base, au cœur de la théorie de l'attachement, conditionne la capacité ultérieure à explorer le monde et à tolérer la séparation temporaire d'un partenaire. Un protecteur, dans le modèle IFS, agit préventivement pour éviter que l'exilé ne soit à nouveau exposé à la douleur qu'il porte, quitte à générer des comportements en apparence excessifs. La restructuration cognitive appliquée aux schémas de Young combine reconnaissance émotionnelle du schéma et mise à l'épreuve rationnelle de ses prédictions catastrophistes."
            },
            "citationIds": [],
            "validation": {}
          }
        ]
      },
      "citationIds": [],
      "validation": {}
    },
    {
      "id": "card-04",
      "type": "card",
      "content": {
        "title": "Le troisième cavalier : l'attitude défensive",
        "imageRef": null,
        "imageAlt": null,
        "blocks": [
          {
            "id": "card-04-paragraph-01",
            "type": "paragraph",
            "content": {
              "text": "Le silence prolongé d'un partenaire pendant un conflit est fréquemment vécu par l'autre comme un abandon actif, indépendamment de l'intention réelle qui l'a motivé. La cohérence entre l'aperçu affiché et le document livré conditionne la confiance de l'utilisatrice dans l'outil autant que la qualité du contenu clinique lui-même. Les quatre cavaliers de l'apocalypse identifiés par Gottman — critique, mépris, attitude défensive et obstruction — prédisent la rupture avec une fiabilité remarquable lorsqu'ils s'installent durablement dans les échanges du couple."
            },
            "citationIds": [
              "citation-005"
            ],
            "validation": {
              "citationLinks": [
                {
                  "citationId": "citation-005",
                  "claimText": "Le silence prolongé d'un partenaire pendant un conflit est fréquemment vécu par l'autre comme un abandon actif, indépendamment de l'intention réelle qui l'a motivé.",
                  "claimSupport": "pass"
                }
              ]
            }
          },
          {
            "id": "card-04-paragraph-02",
            "type": "paragraph",
            "content": {
              "text": "L'attitude défensive, souvent une réaction au mépris ou à la critique, empêche toute réparation en renvoyant systématiquement la responsabilité vers l'autre. L'obstruction — se murer dans le silence, quitter la pièce, refuser tout échange — protège temporairement mais prive le couple de tout espace de réparation. La théorie de l'attachement de Bowlby postule que les premières relations avec les figures d'attachement façonnent des modèles internes opérants qui guideront les relations adultes."
            },
            "citationIds": [
              "citation-006"
            ],
            "validation": {
              "citationLinks": [
                {
                  "citationId": "citation-006",